{
  "registryVersion": "0.1.0",
  "generatedAt": "2026-08-06T22:00:00Z",
  "status": "discovery-seed",
  "scoreScale": "0-100",
  "sources": [
    {
      "id": "holy-see-vatican",
      "name": "The Holy See",
      "url": "https://www.vatican.va/",
      "traditions": ["catholic"],
      "languages": ["la", "it", "en", "pt", "es", "fr", "de"],
      "domains": ["documents", "saints", "hierarchy", "canonizations", "liturgical-law"],
      "access": ["html", "pdf"],
      "authorityClass": "A1",
      "authorityScore": 100,
      "priority": "P0",
      "notes": "Primary promulgation and institutional source."
    },
    {
      "id": "holy-see-press-office",
      "name": "Holy See Press Office",
      "url": "https://press.vatican.va/",
      "traditions": ["catholic"],
      "languages": ["it", "en", "es", "fr", "de", "pt"],
      "domains": ["appointments", "hierarchy", "decrees", "events", "documents"],
      "access": ["html", "pdf", "rss"],
      "authorityClass": "A1",
      "authorityScore": 100,
      "priority": "P0"
    },
    {
      "id": "vatican-news-liturgical-holidays-pt",
      "name": "Vatican News — Feriados litúrgicos",
      "url": "https://www.vaticannews.va/pt/feriados-liturgicos.html",
      "traditions": ["catholic"],
      "languages": ["pt"],
      "domains": ["calendar", "feasts", "saints", "media"],
      "access": ["html"],
      "authorityClass": "A1",
      "authorityScore": 96,
      "priority": "P0"
    },
    {
      "id": "portugal-national-liturgy-secretariat",
      "name": "Secretariado Nacional de Liturgia",
      "url": "https://www.liturgia.pt/",
      "traditions": ["catholic"],
      "jurisdictions": ["PT"],
      "languages": ["pt"],
      "domains": ["calendar", "lectionary", "saints", "liturgical-colours", "ics"],
      "access": ["html", "ics", "pdf"],
      "authorityClass": "A2",
      "authorityScore": 98,
      "priority": "P0"
    },
    {
      "id": "catholic-hierarchy",
      "name": "Catholic-Hierarchy",
      "url": "https://www.catholic-hierarchy.org/",
      "traditions": ["catholic"],
      "languages": ["en"],
      "domains": ["persons", "bishops", "cardinals", "dioceses", "appointments", "succession"],
      "access": ["html"],
      "authorityClass": "B2",
      "authorityScore": 83,
      "priority": "P0",
      "notes": "High-value specialist directory; verify normative facts against official bulletins."
    },
    {
      "id": "gcatholic",
      "name": "GCatholic",
      "url": "https://gcatholic.org/",
      "traditions": ["catholic"],
      "languages": ["en"],
      "domains": ["calendar", "hierarchy", "dioceses", "persons", "churches", "ics"],
      "access": ["html", "ics"],
      "authorityClass": "B2",
      "authorityScore": 80,
      "priority": "P0"
    },
    {
      "id": "arautos-liturgia-diaria",
      "name": "Arautos do Evangelho — Liturgia diária",
      "url": "https://www.arautos.org/liturgia-diaria",
      "traditions": ["catholic"],
      "languages": ["pt"],
      "domains": ["calendar", "lectionary", "saints", "biographies", "devotional-content"],
      "access": ["html"],
      "authorityClass": "C2",
      "authorityScore": 61,
      "priority": "P1",
      "notes": "Editorial enrichment and discovery source; copyright review required before text reuse."
    },
    {
      "id": "goarch-planner",
      "name": "Greek Orthodox Archdiocese of America — Digital Planner",
      "url": "https://www.goarch.org/chapel/planner",
      "traditions": ["eastern-orthodox"],
      "jurisdictions": ["US-GOARCH"],
      "languages": ["en", "el"],
      "domains": ["calendar", "saints", "feasts", "fasting", "lectionary", "ics"],
      "access": ["html", "ics", "zip", "pdf"],
      "authorityClass": "A2",
      "authorityScore": 94,
      "priority": "P0"
    },
    {
      "id": "orthodox-calendar-api-ispovednik",
      "name": "Orthodox Calendar API",
      "url": "https://api.ispovednik.org/",
      "traditions": ["eastern-orthodox"],
      "languages": ["ru", "en"],
      "domains": ["calendar", "saints", "feasts", "fasting", "memorial-days", "icons"],
      "access": ["json", "openapi", "api"],
      "authorityClass": "B1",
      "authorityScore": 76,
      "priority": "P0",
      "notes": "Structured source requiring provenance and jurisdiction review."
    },
    {
      "id": "orthodox-church-in-america",
      "name": "Orthodox Church in America",
      "url": "https://www.oca.org/",
      "traditions": ["eastern-orthodox"],
      "jurisdictions": ["OCA"],
      "languages": ["en"],
      "domains": ["calendar", "saints", "hierarchy", "dioceses", "lectionary", "news"],
      "access": ["html", "rss"],
      "authorityClass": "A2",
      "authorityScore": 95,
      "priority": "P0"
    },
    {
      "id": "coptic-orthodox-patriarchate",
      "name": "Coptic Orthodox Church",
      "url": "https://copticorthodox.church/",
      "traditions": ["oriental-orthodox", "coptic-orthodox"],
      "languages": ["ar", "en"],
      "domains": ["hierarchy", "calendar", "saints", "documents", "media"],
      "access": ["html", "media"],
      "authorityClass": "A1",
      "authorityScore": 97,
      "priority": "P0"
    },
    {
      "id": "armenian-apostolic-church",
      "name": "Mother See of Holy Etchmiadzin",
      "url": "https://www.armenianchurch.org/",
      "traditions": ["oriental-orthodox", "armenian-apostolic"],
      "languages": ["hy", "en", "ru"],
      "domains": ["calendar", "saints", "hierarchy", "documents", "media"],
      "access": ["html", "pdf", "media"],
      "authorityClass": "A1",
      "authorityScore": 98,
      "priority": "P0"
    },
    {
      "id": "anglican-communion-office",
      "name": "Anglican Communion Office",
      "url": "https://www.anglicancommunion.org/",
      "traditions": ["anglican"],
      "languages": ["en", "pt", "fr", "es"],
      "domains": ["churches", "provinces", "dioceses", "leaders", "calendar", "documents"],
      "access": ["html", "pdf"],
      "authorityClass": "A1",
      "authorityScore": 98,
      "priority": "P0"
    },
    {
      "id": "church-of-england",
      "name": "Church of England",
      "url": "https://www.churchofengland.org/",
      "traditions": ["anglican"],
      "jurisdictions": ["GB-ENG"],
      "languages": ["en"],
      "domains": ["calendar", "saints", "lectionary", "hierarchy", "dioceses", "parishes", "live-streams"],
      "access": ["html", "pdf", "api"],
      "authorityClass": "A1",
      "authorityScore": 99,
      "priority": "P0"
    },
    {
      "id": "episcopal-church-usa",
      "name": "The Episcopal Church",
      "url": "https://www.episcopalchurch.org/",
      "traditions": ["anglican", "episcopal"],
      "jurisdictions": ["US"],
      "languages": ["en", "es"],
      "domains": ["calendar", "saints", "lectionary", "hierarchy", "dioceses", "documents"],
      "access": ["html", "pdf"],
      "authorityClass": "A1",
      "authorityScore": 98,
      "priority": "P0"
    },
    {
      "id": "lutheran-world-federation",
      "name": "The Lutheran World Federation",
      "url": "https://lutheranworld.org/",
      "traditions": ["lutheran"],
      "languages": ["en", "de", "fr", "es"],
      "domains": ["member-churches", "leaders", "documents", "news", "media"],
      "access": ["html", "pdf", "rss"],
      "authorityClass": "A1",
      "authorityScore": 96,
      "priority": "P1"
    },
    {
      "id": "world-communion-reformed-churches",
      "name": "World Communion of Reformed Churches",
      "url": "https://wcrc.eu/",
      "traditions": ["reformed", "presbyterian", "congregational"],
      "languages": ["en", "de", "fr", "es"],
      "domains": ["member-churches", "leaders", "documents", "news"],
      "access": ["html", "pdf"],
      "authorityClass": "A1",
      "authorityScore": 95,
      "priority": "P1"
    },
    {
      "id": "world-methodist-council",
      "name": "World Methodist Council",
      "url": "https://worldmethodistcouncil.org/",
      "traditions": ["methodist", "wesleyan"],
      "languages": ["en"],
      "domains": ["member-churches", "leaders", "documents", "news"],
      "access": ["html", "pdf"],
      "authorityClass": "A1",
      "authorityScore": 94,
      "priority": "P1"
    },
    {
      "id": "baptist-world-alliance",
      "name": "Baptist World Alliance",
      "url": "https://baptistworld.org/",
      "traditions": ["baptist"],
      "languages": ["en", "es", "fr"],
      "domains": ["member-bodies", "leaders", "documents", "news", "media"],
      "access": ["html", "pdf"],
      "authorityClass": "A1",
      "authorityScore": 94,
      "priority": "P1"
    },
    {
      "id": "world-assemblies-of-god-fellowship",
      "name": "World Assemblies of God Fellowship",
      "url": "https://worldagfellowship.org/",
      "traditions": ["pentecostal"],
      "languages": ["en"],
      "domains": ["member-churches", "leaders", "documents", "news"],
      "access": ["html"],
      "authorityClass": "A1",
      "authorityScore": 92,
      "priority": "P1"
    },
    {
      "id": "general-conference-adventist",
      "name": "General Conference of Seventh-day Adventists",
      "url": "https://www.adventist.org/",
      "traditions": ["seventh-day-adventist"],
      "languages": ["en", "es", "fr", "pt"],
      "domains": ["hierarchy", "regions", "beliefs", "documents", "media", "live-streams"],
      "access": ["html", "pdf", "media"],
      "authorityClass": "A1",
      "authorityScore": 98,
      "priority": "P1"
    },
    {
      "id": "world-council-of-churches",
      "name": "World Council of Churches",
      "url": "https://www.oikoumene.org/",
      "traditions": ["ecumenical"],
      "languages": ["en", "fr", "de", "es"],
      "domains": ["member-churches", "leaders", "documents", "news", "media"],
      "access": ["html", "pdf", "rss"],
      "authorityClass": "B1",
      "authorityScore": 91,
      "priority": "P1"
    },
    {
      "id": "openbible",